
*** Running vivado
    with args -log img_success.vds -m64 -product Vivado -mode batch -messageDb vivado.pb -notrace -source img_success.tcl


****** Vivado v2019.2 (64-bit)
  **** SW Build 2708876 on Wed Nov  6 21:40:23 MST 2019
  **** IP Build 2700528 on Thu Nov  7 00:09:20 MST 2019
    ** Copyright 1986-2019 Xilinx, Inc. All Rights Reserved.

source img_success.tcl -notrace
create_project: Time (s): cpu = 00:00:05 ; elapsed = 00:00:13 . Memory (MB): peak = 450.270 ; gain = 124.457
Command: synth_design -top img_success -part xc7a100tcsg324-1 -mode out_of_context
Starting synth_design
Attempting to get a license for feature 'Synthesis' and/or device 'xc7a100t'
INFO: [Common 17-349] Got license for feature 'Synthesis' and/or device 'xc7a100t'
INFO: [Device 21-403] Loading part xc7a100tcsg324-1
INFO: Launching helper process for spawning children vivado processes
INFO: Helper process launched with PID 8620 
---------------------------------------------------------------------------------
Starting RTL Elaboration : Time (s): cpu = 00:00:15 ; elapsed = 00:00:32 . Memory (MB): peak = 1001.055 ; gain = 235.066
---------------------------------------------------------------------------------
INFO: [Synth 8-638] synthesizing module 'img_success' [d:/VivadoProject/FLXG/FLXG.srcs/sources_1/ip/img_success/synth/img_success.vhd:68]
	Parameter C_FAMILY bound to: artix7 - type: string 
	Parameter C_XDEVICEFAMILY bound to: artix7 - type: string 
	Parameter C_ELABORATION_DIR bound to: ./ - type: string 
	Parameter C_INTERFACE_TYPE bound to: 0 - type: integer 
	Parameter C_AXI_TYPE bound to: 1 - type: integer 
	Parameter C_AXI_SLAVE_TYPE bound to: 0 - type: integer 
	Parameter C_USE_BRAM_BLOCK bound to: 0 - type: integer 
	Parameter C_ENABLE_32BIT_ADDRESS bound to: 0 - type: integer 
	Parameter C_CTRL_ECC_ALGO bound to: NONE - type: string 
	Parameter C_HAS_AXI_ID bound to: 0 - type: integer 
	Parameter C_AXI_ID_WIDTH bound to: 4 - type: integer 
	Parameter C_MEM_TYPE bound to: 3 - type: integer 
	Parameter C_BYTE_SIZE bound to: 9 - type: integer 
	Parameter C_ALGORITHM bound to: 1 - type: integer 
	Parameter C_PRIM_TYPE bound to: 1 - type: integer 
	Parameter C_LOAD_INIT_FILE bound to: 1 - type: integer 
	Parameter C_INIT_FILE_NAME bound to: img_success.mif - type: string 
	Parameter C_INIT_FILE bound to: img_success.mem - type: string 
	Parameter C_USE_DEFAULT_DATA bound to: 0 - type: integer 
	Parameter C_DEFAULT_DATA bound to: 0 - type: string 
	Parameter C_HAS_RSTA bound to: 0 - type: integer 
	Parameter C_RST_PRIORITY_A bound to: CE - type: string 
	Parameter C_RSTRAM_A bound to: 0 - type: integer 
	Parameter C_INITA_VAL bound to: 0 - type: string 
	Parameter C_HAS_ENA bound to: 1 - type: integer 
	Parameter C_HAS_REGCEA bound to: 0 - type: integer 
	Parameter C_USE_BYTE_WEA bound to: 0 - type: integer 
	Parameter C_WEA_WIDTH bound to: 1 - type: integer 
	Parameter C_WRITE_MODE_A bound to: WRITE_FIRST - type: string 
	Parameter C_WRITE_WIDTH_A bound to: 12 - type: integer 
	Parameter C_READ_WIDTH_A bound to: 12 - type: integer 
	Parameter C_WRITE_DEPTH_A bound to: 40000 - type: integer 
	Parameter C_READ_DEPTH_A bound to: 40000 - type: integer 
	Parameter C_ADDRA_WIDTH bound to: 16 - type: integer 
	Parameter C_HAS_RSTB bound to: 0 - type: integer 
	Parameter C_RST_PRIORITY_B bound to: CE - type: string 
	Parameter C_RSTRAM_B bound to: 0 - type: integer 
	Parameter C_INITB_VAL bound to: 0 - type: string 
	Parameter C_HAS_ENB bound to: 0 - type: integer 
	Parameter C_HAS_REGCEB bound to: 0 - type: integer 
	Parameter C_USE_BYTE_WEB bound to: 0 - type: integer 
	Parameter C_WEB_WIDTH bound to: 1 - type: integer 
	Parameter C_WRITE_MODE_B bound to: WRITE_FIRST - type: string 
	Parameter C_WRITE_WIDTH_B bound to: 12 - type: integer 
	Parameter C_READ_WIDTH_B bound to: 12 - type: integer 
	Parameter C_WRITE_DEPTH_B bound to: 40000 - type: integer 
	Parameter C_READ_DEPTH_B bound to: 40000 - type: integer 
	Parameter C_ADDRB_WIDTH bound to: 16 - type: integer 
	Parameter C_HAS_MEM_OUTPUT_REGS_A bound to: 1 - type: integer 
	Parameter C_HAS_MEM_OUTPUT_REGS_B bound to: 0 - type: integer 
	Parameter C_HAS_MUX_OUTPUT_REGS_A bound to: 0 - type: integer 
	Parameter C_HAS_MUX_OUTPUT_REGS_B bound to: 0 - type: integer 
	Parameter C_MUX_PIPELINE_STAGES bound to: 0 - type: integer 
	Parameter C_HAS_SOFTECC_INPUT_REGS_A bound to: 0 - type: integer 
	Parameter C_HAS_SOFTECC_OUTPUT_REGS_B bound to: 0 - type: integer 
	Parameter C_USE_SOFTECC bound to: 0 - type: integer 
	Parameter C_USE_ECC bound to: 0 - type: integer 
	Parameter C_EN_ECC_PIPE bound to: 0 - type: integer 
	Parameter C_READ_LATENCY_A bound to: 1 - type: integer 
	Parameter C_READ_LATENCY_B bound to: 1 - type: integer 
	Parameter C_HAS_INJECTERR bound to: 0 - type: integer 
	Parameter C_SIM_COLLISION_CHECK bound to: ALL - type: string 
	Parameter C_COMMON_CLK bound to: 0 - type: integer 
	Parameter C_DISABLE_WARN_BHV_COLL bound to: 0 - type: integer 
	Parameter C_EN_SLEEP_PIN bound to: 0 - type: integer 
	Parameter C_USE_URAM bound to: 0 - type: integer 
	Parameter C_EN_RDADDRA_CHG bound to: 0 - type: integer 
	Parameter C_EN_RDADDRB_CHG bound to: 0 - type: integer 
	Parameter C_EN_DEEPSLEEP_PIN bound to: 0 - type: integer 
	Parameter C_EN_SHUTDOWN_PIN bound to: 0 - type: integer 
	Parameter C_EN_SAFETY_CKT bound to: 0 - type: integer 
	Parameter C_DISABLE_WARN_BHV_RANGE bound to: 0 - type: integer 
	Parameter C_COUNT_36K_BRAM bound to: 13 - type: string 
	Parameter C_COUNT_18K_BRAM bound to: 2 - type: string 
	Parameter C_EST_POWER_SUMMARY bound to: Estimated Power for IP     :     8.217811 mW - type: string 
INFO: [Synth 8-3491] module 'blk_mem_gen_v8_4_4' declared at 'd:/VivadoProject/FLXG/FLXG.srcs/sources_1/ip/img_success/hdl/blk_mem_gen_v8_4_vhsyn_rfs.vhd:195321' bound to instance 'U0' of component 'blk_mem_gen_v8_4_4' [d:/VivadoProject/FLXG/FLXG.srcs/sources_1/ip/img_success/synth/img_success.vhd:232]
INFO: [Synth 8-256] done synthesizing module 'img_success' (11#1) [d:/VivadoProject/FLXG/FLXG.srcs/sources_1/ip/img_success/synth/img_success.vhd:68]
WARNING: [Synth 8-3331] design blk_mem_output_block has unconnected port CLKB
WARNING: [Synth 8-3331] design blk_mem_output_block has unconnected port DOUTB_I[11]
WARNING: [Synth 8-3331] design blk_mem_output_block has unconnected port DOUTB_I[10]
WARNING: [Synth 8-3331] design blk_mem_output_block has unconnected port DOUTB_I[9]
WARNING: [Synth 8-3331] design blk_mem_output_block has unconnected port DOUTB_I[8]
WARNING: [Synth 8-3331] design blk_mem_output_block has unconnected port DOUTB_I[7]
WARNING: [Synth 8-3331] design blk_mem_output_block has unconnected port DOUTB_I[6]
WARNING: [Synth 8-3331] design blk_mem_output_block has unconnected port DOUTB_I[5]
WARNING: [Synth 8-3331] design blk_mem_output_block has unconnected port DOUTB_I[4]
WARNING: [Synth 8-3331] design blk_mem_output_block has unconnected port DOUTB_I[3]
WARNING: [Synth 8-3331] design blk_mem_output_block has unconnected port DOUTB_I[2]
WARNING: [Synth 8-3331] design blk_mem_output_block has unconnected port DOUTB_I[1]
WARNING: [Synth 8-3331] design blk_mem_output_block has unconnected port DOUTB_I[0]
WARNING: [Synth 8-3331] design blk_mem_output_block has unconnected port SBITERR_I
WARNING: [Synth 8-3331] design blk_mem_output_block has unconnected port DBITERR_I
WARNING: [Synth 8-3331] design blk_mem_output_block has unconnected port RDADDRECC_I[15]
WARNING: [Synth 8-3331] design blk_mem_output_block has unconnected port RDADDRECC_I[14]
WARNING: [Synth 8-3331] design blk_mem_output_block has unconnected port RDADDRECC_I[13]
WARNING: [Synth 8-3331] design blk_mem_output_block has unconnected port RDADDRECC_I[12]
WARNING: [Synth 8-3331] design blk_mem_output_block has unconnected port RDADDRECC_I[11]
WARNING: [Synth 8-3331] design blk_mem_output_block has unconnected port RDADDRECC_I[10]
WARNING: [Synth 8-3331] design blk_mem_output_block has unconnected port RDADDRECC_I[9]
WARNING: [Synth 8-3331] design blk_mem_output_block has unconnected port RDADDRECC_I[8]
WARNING: [Synth 8-3331] design blk_mem_output_block has unconnected port RDADDRECC_I[7]
WARNING: [Synth 8-3331] design blk_mem_output_block has unconnected port RDADDRECC_I[6]
WARNING: [Synth 8-3331] design blk_mem_output_block has unconnected port RDADDRECC_I[5]
WARNING: [Synth 8-3331] design blk_mem_output_block has unconnected port RDADDRECC_I[4]
WARNING: [Synth 8-3331] design blk_mem_output_block has unconnected port RDADDRECC_I[3]
WARNING: [Synth 8-3331] design blk_mem_output_block has unconnected port RDADDRECC_I[2]
WARNING: [Synth 8-3331] design blk_mem_output_block has unconnected port RDADDRECC_I[1]
WARNING: [Synth 8-3331] design blk_mem_output_block has unconnected port RDADDRECC_I[0]
WARNING: [Synth 8-3331] design blk_mem_gen_prim_wrapper_init__parameterized13 has unconnected port SSRA
WARNING: [Synth 8-3331] design blk_mem_gen_prim_wrapper_init__parameterized13 has unconnected port CLKB
WARNING: [Synth 8-3331] design blk_mem_gen_prim_wrapper_init__parameterized13 has unconnected port SSRB
WARNING: [Synth 8-3331] design blk_mem_gen_prim_wrapper_init__parameterized13 has unconnected port ENB
WARNING: [Synth 8-3331] design blk_mem_gen_prim_wrapper_init__parameterized13 has unconnected port REGCEB
WARNING: [Synth 8-3331] design blk_mem_gen_prim_wrapper_init__parameterized13 has unconnected port WEB[0]
WARNING: [Synth 8-3331] design blk_mem_gen_prim_wrapper_init__parameterized13 has unconnected port ADDRB[11]
WARNING: [Synth 8-3331] design blk_mem_gen_prim_wrapper_init__parameterized13 has unconnected port ADDRB[10]
WARNING: [Synth 8-3331] design blk_mem_gen_prim_wrapper_init__parameterized13 has unconnected port ADDRB[9]
WARNING: [Synth 8-3331] design blk_mem_gen_prim_wrapper_init__parameterized13 has unconnected port ADDRB[8]
WARNING: [Synth 8-3331] design blk_mem_gen_prim_wrapper_init__parameterized13 has unconnected port ADDRB[7]
WARNING: [Synth 8-3331] design blk_mem_gen_prim_wrapper_init__parameterized13 has unconnected port ADDRB[6]
WARNING: [Synth 8-3331] design blk_mem_gen_prim_wrapper_init__parameterized13 has unconnected port ADDRB[5]
WARNING: [Synth 8-3331] design blk_mem_gen_prim_wrapper_init__parameterized13 has unconnected port ADDRB[4]
WARNING: [Synth 8-3331] design blk_mem_gen_prim_wrapper_init__parameterized13 has unconnected port ADDRB[3]
WARNING: [Synth 8-3331] design blk_mem_gen_prim_wrapper_init__parameterized13 has unconnected port ADDRB[2]
WARNING: [Synth 8-3331] design blk_mem_gen_prim_wrapper_init__parameterized13 has unconnected port ADDRB[1]
WARNING: [Synth 8-3331] design blk_mem_gen_prim_wrapper_init__parameterized13 has unconnected port ADDRB[0]
WARNING: [Synth 8-3331] design blk_mem_gen_prim_wrapper_init__parameterized13 has unconnected port DINB[8]
WARNING: [Synth 8-3331] design blk_mem_gen_prim_wrapper_init__parameterized13 has unconnected port DINB[7]
WARNING: [Synth 8-3331] design blk_mem_gen_prim_wrapper_init__parameterized13 has unconnected port DINB[6]
WARNING: [Synth 8-3331] design blk_mem_gen_prim_wrapper_init__parameterized13 has unconnected port DINB[5]
WARNING: [Synth 8-3331] design blk_mem_gen_prim_wrapper_init__parameterized13 has unconnected port DINB[4]
WARNING: [Synth 8-3331] design blk_mem_gen_prim_wrapper_init__parameterized13 has unconnected port DINB[3]
WARNING: [Synth 8-3331] design blk_mem_gen_prim_wrapper_init__parameterized13 has unconnected port DINB[2]
WARNING: [Synth 8-3331] design blk_mem_gen_prim_wrapper_init__parameterized13 has unconnected port DINB[1]
WARNING: [Synth 8-3331] design blk_mem_gen_prim_wrapper_init__parameterized13 has unconnected port DINB[0]
WARNING: [Synth 8-3331] design blk_mem_gen_prim_wrapper_init__parameterized13 has unconnected port SLEEP
WARNING: [Synth 8-3331] design blk_mem_gen_prim_wrapper_init__parameterized13 has unconnected port INJECTSBITERR
WARNING: [Synth 8-3331] design blk_mem_gen_prim_wrapper_init__parameterized13 has unconnected port INJECTDBITERR
WARNING: [Synth 8-3331] design blk_mem_gen_prim_wrapper_init__parameterized13 has unconnected port ECCPIPECE
WARNING: [Synth 8-3331] design blk_mem_gen_prim_wrapper_init__parameterized13 has unconnected port ram_rstram_b
WARNING: [Synth 8-3331] design blk_mem_gen_prim_wrapper_init__parameterized13 has unconnected port ram_rstreg_b
WARNING: [Synth 8-3331] design blk_mem_gen_prim_wrapper_init__parameterized12 has unconnected port SSRA
WARNING: [Synth 8-3331] design blk_mem_gen_prim_wrapper_init__parameterized12 has unconnected port CLKB
WARNING: [Synth 8-3331] design blk_mem_gen_prim_wrapper_init__parameterized12 has unconnected port SSRB
WARNING: [Synth 8-3331] design blk_mem_gen_prim_wrapper_init__parameterized12 has unconnected port ENB
WARNING: [Synth 8-3331] design blk_mem_gen_prim_wrapper_init__parameterized12 has unconnected port REGCEB
WARNING: [Synth 8-3331] design blk_mem_gen_prim_wrapper_init__parameterized12 has unconnected port WEB[0]
WARNING: [Synth 8-3331] design blk_mem_gen_prim_wrapper_init__parameterized12 has unconnected port ADDRB[11]
WARNING: [Synth 8-3331] design blk_mem_gen_prim_wrapper_init__parameterized12 has unconnected port ADDRB[10]
WARNING: [Synth 8-3331] design blk_mem_gen_prim_wrapper_init__parameterized12 has unconnected port ADDRB[9]
WARNING: [Synth 8-3331] design blk_mem_gen_prim_wrapper_init__parameterized12 has unconnected port ADDRB[8]
WARNING: [Synth 8-3331] design blk_mem_gen_prim_wrapper_init__parameterized12 has unconnected port ADDRB[7]
WARNING: [Synth 8-3331] design blk_mem_gen_prim_wrapper_init__parameterized12 has unconnected port ADDRB[6]
WARNING: [Synth 8-3331] design blk_mem_gen_prim_wrapper_init__parameterized12 has unconnected port ADDRB[5]
WARNING: [Synth 8-3331] design blk_mem_gen_prim_wrapper_init__parameterized12 has unconnected port ADDRB[4]
WARNING: [Synth 8-3331] design blk_mem_gen_prim_wrapper_init__parameterized12 has unconnected port ADDRB[3]
WARNING: [Synth 8-3331] design blk_mem_gen_prim_wrapper_init__parameterized12 has unconnected port ADDRB[2]
WARNING: [Synth 8-3331] design blk_mem_gen_prim_wrapper_init__parameterized12 has unconnected port ADDRB[1]
WARNING: [Synth 8-3331] design blk_mem_gen_prim_wrapper_init__parameterized12 has unconnected port ADDRB[0]
WARNING: [Synth 8-3331] design blk_mem_gen_prim_wrapper_init__parameterized12 has unconnected port DINB[8]
WARNING: [Synth 8-3331] design blk_mem_gen_prim_wrapper_init__parameterized12 has unconnected port DINB[7]
WARNING: [Synth 8-3331] design blk_mem_gen_prim_wrapper_init__parameterized12 has unconnected port DINB[6]
WARNING: [Synth 8-3331] design blk_mem_gen_prim_wrapper_init__parameterized12 has unconnected port DINB[5]
WARNING: [Synth 8-3331] design blk_mem_gen_prim_wrapper_init__parameterized12 has unconnected port DINB[4]
WARNING: [Synth 8-3331] design blk_mem_gen_prim_wrapper_init__parameterized12 has unconnected port DINB[3]
WARNING: [Synth 8-3331] design blk_mem_gen_prim_wrapper_init__parameterized12 has unconnected port DINB[2]
WARNING: [Synth 8-3331] design blk_mem_gen_prim_wrapper_init__parameterized12 has unconnected port DINB[1]
WARNING: [Synth 8-3331] design blk_mem_gen_prim_wrapper_init__parameterized12 has unconnected port DINB[0]
WARNING: [Synth 8-3331] design blk_mem_gen_prim_wrapper_init__parameterized12 has unconnected port SLEEP
WARNING: [Synth 8-3331] design blk_mem_gen_prim_wrapper_init__parameterized12 has unconnected port INJECTSBITERR
WARNING: [Synth 8-3331] design blk_mem_gen_prim_wrapper_init__parameterized12 has unconnected port INJECTDBITERR
WARNING: [Synth 8-3331] design blk_mem_gen_prim_wrapper_init__parameterized12 has unconnected port ECCPIPECE
WARNING: [Synth 8-3331] design blk_mem_gen_prim_wrapper_init__parameterized12 has unconnected port ram_rstram_b
WARNING: [Synth 8-3331] design blk_mem_gen_prim_wrapper_init__parameterized12 has unconnected port ram_rstreg_b
WARNING: [Synth 8-3331] design blk_mem_gen_prim_wrapper_init__parameterized11 has unconnected port SSRA
WARNING: [Synth 8-3331] design blk_mem_gen_prim_wrapper_init__parameterized11 has unconnected port CLKB
WARNING: [Synth 8-3331] design blk_mem_gen_prim_wrapper_init__parameterized11 has unconnected port SSRB
INFO: [Common 17-14] Message 'Synth 8-3331' appears 100 times and further instances of the messages will be disabled. Use the Tcl command set_msg_config to change the current settings.
---------------------------------------------------------------------------------
Finished RTL Elaboration : Time (s): cpu = 00:01:38 ; elapsed = 00:02:04 . Memory (MB): peak = 1351.914 ; gain = 585.926
---------------------------------------------------------------------------------

Report Check Netlist: 
+------+------------------+-------+---------+-------+------------------+
|      |Item              |Errors |Warnings |Status |Description       |
+------+------------------+-------+---------+-------+------------------+
|1     |multi_driven_nets |      0|        0|Passed |Multi driven nets |
+------+------------------+-------+---------+-------+------------------+
---------------------------------------------------------------------------------
Start Handling Custom Attributes
---------------------------------------------------------------------------------
---------------------------------------------------------------------------------
Finished Handling Custom Attributes : Time (s): cpu = 00:01:39 ; elapsed = 00:02:05 . Memory (MB): peak = 1351.914 ; gain = 585.926
---------------------------------------------------------------------------------
---------------------------------------------------------------------------------
Finished RTL Optimization Phase 1 : Time (s): cpu = 00:01:39 ; elapsed = 00:02:05 . Memory (MB): peak = 1351.914 ; gain = 585.926
---------------------------------------------------------------------------------
Netlist sorting complete. Time (s): cpu = 00:00:00 ; elapsed = 00:00:00.056 . Memory (MB): peak = 1351.914 ; gain = 0.000
INFO: [Netlist 29-17] Analyzing 15 Unisim elements for replacement
INFO: [Netlist 29-28] Unisim Transformation completed in 0 CPU seconds
INFO: [Project 1-570] Preparing netlist for logic optimization

Processing XDC Constraints
Initializing timing engine
Parsing XDC File [d:/VivadoProject/FLXG/FLXG.srcs/sources_1/ip/img_success/img_success_ooc.xdc] for cell 'U0'
Finished Parsing XDC File [d:/VivadoProject/FLXG/FLXG.srcs/sources_1/ip/img_success/img_success_ooc.xdc] for cell 'U0'
Parsing XDC File [D:/VivadoProject/FLXG/FLXG.runs/img_success_synth_1/dont_touch.xdc]
Finished Parsing XDC File [D:/VivadoProject/FLXG/FLXG.runs/img_success_synth_1/dont_touch.xdc]
Completed Processing XDC Constraints

Netlist sorting complete. Time (s): cpu = 00:00:00 ; elapsed = 00:00:00.001 . Memory (MB): peak = 1351.914 ; gain = 0.000
INFO: [Project 1-111] Unisim Transformation Summary:
No Unisim elements were transformed.

Constraint Validation Runtime : Time (s): cpu = 00:00:00 ; elapsed = 00:00:00.450 . Memory (MB): peak = 1351.914 ; gain = 0.000
---------------------------------------------------------------------------------
Finished Constraint Validation : Time (s): cpu = 00:01:55 ; elapsed = 00:02:24 . Memory (MB): peak = 1351.914 ; gain = 585.926
---------------------------------------------------------------------------------
---------------------------------------------------------------------------------
Start Loading Part and Timing Information
---------------------------------------------------------------------------------
Loading part: xc7a100tcsg324-1
---------------------------------------------------------------------------------
Finished Loading Part and Timing Information : Time (s): cpu = 00:01:55 ; elapsed = 00:02:24 . Memory (MB): peak = 1351.914 ; gain = 585.926
---------------------------------------------------------------------------------
---------------------------------------------------------------------------------
Start Applying 'set_property' XDC Constraints
---------------------------------------------------------------------------------
Applied set_property DONT_TOUCH = true for U0. (constraint file  D:/VivadoProject/FLXG/FLXG.runs/img_success_synth_1/dont_touch.xdc, line 9).
---------------------------------------------------------------------------------
Finished applying 'set_property' XDC Constraints : Time (s): cpu = 00:01:55 ; elapsed = 00:02:25 . Memory (MB): peak = 1351.914 ; gain = 585.926
---------------------------------------------------------------------------------
---------------------------------------------------------------------------------
Finished RTL Optimization Phase 2 : Time (s): cpu = 00:01:56 ; elapsed = 00:02:27 . Memory (MB): peak = 1351.914 ; gain = 585.926
---------------------------------------------------------------------------------

Report RTL Partitions: 
+-+--------------+------------+----------+
| |RTL Partition |Replication |Instances |
+-+--------------+------------+----------+
+-+--------------+------------+----------+
---------------------------------------------------------------------------------
Start RTL Component Statistics 
---------------------------------------------------------------------------------
Detailed RTL Component Info : 
+---Registers : 
	               16 Bit    Registers := 1     
	                4 Bit    Registers := 3     
+---Muxes : 
	   2 Input      1 Bit        Muxes := 33    
---------------------------------------------------------------------------------
Finished RTL Component Statistics 
---------------------------------------------------------------------------------
---------------------------------------------------------------------------------
Start RTL Hierarchical Component Statistics 
---------------------------------------------------------------------------------
Hierarchical RTL Component report 
Module bindec 
Detailed RTL Component Info : 
+---Muxes : 
	   2 Input      1 Bit        Muxes := 16    
Module blk_mem_gen_mux 
Detailed RTL Component Info : 
+---Registers : 
	               16 Bit    Registers := 1     
	                4 Bit    Registers := 2     
+---Muxes : 
	   2 Input      1 Bit        Muxes := 1     
Module blk_mem_gen_mux__parameterized0 
Detailed RTL Component Info : 
+---Registers : 
	                4 Bit    Registers := 1     
---------------------------------------------------------------------------------
Finished RTL Hierarchical Component Statistics
---------------------------------------------------------------------------------
---------------------------------------------------------------------------------
Start Part Resource Summary
---------------------------------------------------------------------------------
Part Resources:
DSPs: 240 (col length:80)
BRAMs: 270 (col length: RAMB18 80 RAMB36 40)
---------------------------------------------------------------------------------
Finished Part Resource Summary
---------------------------------------------------------------------------------
---------------------------------------------------------------------------------
Start Cross Boundary and Area Optimization
---------------------------------------------------------------------------------
Warning: Parallel synthesis criteria is not met 
---------------------------------------------------------------------------------
Finished Cross Boundary and Area Optimization : Time (s): cpu = 00:02:00 ; elapsed = 00:02:34 . Memory (MB): peak = 1351.914 ; gain = 585.926
---------------------------------------------------------------------------------

Report RTL Partitions: 
+-+--------------+------------+----------+
| |RTL Partition |Replication |Instances |
+-+--------------+------------+----------+
+-+--------------+------------+----------+
---------------------------------------------------------------------------------
Start Applying XDC Timing Constraints
---------------------------------------------------------------------------------
---------------------------------------------------------------------------------
Finished Applying XDC Timing Constraints : Time (s): cpu = 00:02:20 ; elapsed = 00:02:55 . Memory (MB): peak = 1351.914 ; gain = 585.926
---------------------------------------------------------------------------------
---------------------------------------------------------------------------------
Start Timing Optimization
---------------------------------------------------------------------------------
---------------------------------------------------------------------------------
Finished Timing Optimization : Time (s): cpu = 00:02:20 ; elapsed = 00:02:55 . Memory (MB): peak = 1351.914 ; gain = 585.926
---------------------------------------------------------------------------------

Report RTL Partitions: 
+-+--------------+------------+----------+
| |RTL Partition |Replication |Instances |
+-+--------------+------------+----------+
+-+--------------+------------+----------+
---------------------------------------------------------------------------------
Start Technology Mapping
---------------------------------------------------------------------------------
---------------------------------------------------------------------------------
Finished Technology Mapping : Time (s): cpu = 00:02:20 ; elapsed = 00:02:55 . Memory (MB): peak = 1351.914 ; gain = 585.926
---------------------------------------------------------------------------------

Report RTL Partitions: 
+-+--------------+------------+----------+
| |RTL Partition |Replication |Instances |
+-+--------------+------------+----------+
+-+--------------+------------+----------+
---------------------------------------------------------------------------------
Start IO Insertion
---------------------------------------------------------------------------------
---------------------------------------------------------------------------------
Start Flattening Before IO Insertion
---------------------------------------------------------------------------------
---------------------------------------------------------------------------------
Finished Flattening Before IO Insertion
---------------------------------------------------------------------------------
---------------------------------------------------------------------------------
Start Final Netlist Cleanup
---------------------------------------------------------------------------------
---------------------------------------------------------------------------------
Finished Final Netlist Cleanup
---------------------------------------------------------------------------------
---------------------------------------------------------------------------------
Finished IO Insertion : Time (s): cpu = 00:02:39 ; elapsed = 00:03:15 . Memory (MB): peak = 1351.914 ; gain = 585.926
---------------------------------------------------------------------------------
---------------------------------------------------------------------------------
Start Renaming Generated Instances
---------------------------------------------------------------------------------
---------------------------------------------------------------------------------
Finished Renaming Generated Instances : Time (s): cpu = 00:02:39 ; elapsed = 00:03:15 . Memory (MB): peak = 1351.914 ; gain = 585.926
---------------------------------------------------------------------------------

Report RTL Partitions: 
+-+--------------+------------+----------+
| |RTL Partition |Replication |Instances |
+-+--------------+------------+----------+
+-+--------------+------------+----------+

Report Check Netlist: 
+------+------------------+-------+---------+-------+------------------+
|      |Item              |Errors |Warnings |Status |Description       |
+------+------------------+-------+---------+-------+------------------+
|1     |multi_driven_nets |      0|        0|Passed |Multi driven nets |
+------+------------------+-------+---------+-------+------------------+
---------------------------------------------------------------------------------
Start Rebuilding User Hierarchy
---------------------------------------------------------------------------------
---------------------------------------------------------------------------------
Finished Rebuilding User Hierarchy : Time (s): cpu = 00:02:39 ; elapsed = 00:03:15 . Memory (MB): peak = 1351.914 ; gain = 585.926
---------------------------------------------------------------------------------
---------------------------------------------------------------------------------
Start Renaming Generated Ports
---------------------------------------------------------------------------------
---------------------------------------------------------------------------------
Finished Renaming Generated Ports : Time (s): cpu = 00:02:39 ; elapsed = 00:03:15 . Memory (MB): peak = 1351.914 ; gain = 585.926
---------------------------------------------------------------------------------
---------------------------------------------------------------------------------
Start Handling Custom Attributes
---------------------------------------------------------------------------------
---------------------------------------------------------------------------------
Finished Handling Custom Attributes : Time (s): cpu = 00:02:39 ; elapsed = 00:03:15 . Memory (MB): peak = 1351.914 ; gain = 585.926
---------------------------------------------------------------------------------
---------------------------------------------------------------------------------
Start Renaming Generated Nets
---------------------------------------------------------------------------------
---------------------------------------------------------------------------------
Finished Renaming Generated Nets : Time (s): cpu = 00:02:39 ; elapsed = 00:03:15 . Memory (MB): peak = 1351.914 ; gain = 585.926
---------------------------------------------------------------------------------
---------------------------------------------------------------------------------
Start Writing Synthesis Report
---------------------------------------------------------------------------------

Report BlackBoxes: 
+-+--------------+----------+
| |BlackBox name |Instances |
+-+--------------+----------+
+-+--------------+----------+

Report Cell Usage: 
+------+------------+------+
|      |Cell        |Count |
+------+------------+------+
|1     |LUT2        |     1|
|2     |LUT3        |     1|
|3     |LUT4        |     2|
|4     |LUT5        |    30|
|5     |LUT6        |    18|
|6     |RAMB18E1    |     1|
|7     |RAMB18E1_1  |     1|
|8     |RAMB36E1    |     1|
|9     |RAMB36E1_1  |     1|
|10    |RAMB36E1_10 |     1|
|11    |RAMB36E1_11 |     1|
|12    |RAMB36E1_12 |     1|
|13    |RAMB36E1_2  |     1|
|14    |RAMB36E1_3  |     1|
|15    |RAMB36E1_4  |     1|
|16    |RAMB36E1_5  |     1|
|17    |RAMB36E1_6  |     1|
|18    |RAMB36E1_7  |     1|
|19    |RAMB36E1_8  |     1|
|20    |RAMB36E1_9  |     1|
|21    |FDRE        |     8|
+------+------------+------+

Report Instance Areas: 
+------+---------------------------------------------+-----------------------------------------------+------+
|      |Instance                                     |Module                                         |Cells |
+------+---------------------------------------------+-----------------------------------------------+------+
|1     |top                                          |                                               |    75|
|2     |  U0                                         |blk_mem_gen_v8_4_4                             |    75|
|3     |    inst_blk_mem_gen                         |blk_mem_gen_v8_4_4_synth                       |    75|
|4     |      \gnbram.gnativebmg.native_blk_mem_gen  |blk_mem_gen_top                                |    75|
|5     |        \valid.cstr                          |blk_mem_gen_generic_cstr                       |    75|
|6     |          \bindec_a.bindec_inst_a            |bindec                                         |     9|
|7     |          \has_mux_a.A                       |blk_mem_gen_mux                                |    47|
|8     |          \ramloop[0].ram.r                  |blk_mem_gen_prim_width                         |     1|
|9     |            \prim_init.ram                   |blk_mem_gen_prim_wrapper_init                  |     1|
|10    |          \ramloop[10].ram.r                 |blk_mem_gen_prim_width__parameterized9         |     1|
|11    |            \prim_init.ram                   |blk_mem_gen_prim_wrapper_init__parameterized9  |     1|
|12    |          \ramloop[11].ram.r                 |blk_mem_gen_prim_width__parameterized10        |     1|
|13    |            \prim_init.ram                   |blk_mem_gen_prim_wrapper_init__parameterized10 |     1|
|14    |          \ramloop[12].ram.r                 |blk_mem_gen_prim_width__parameterized11        |     1|
|15    |            \prim_init.ram                   |blk_mem_gen_prim_wrapper_init__parameterized11 |     1|
|16    |          \ramloop[13].ram.r                 |blk_mem_gen_prim_width__parameterized12        |     1|
|17    |            \prim_init.ram                   |blk_mem_gen_prim_wrapper_init__parameterized12 |     1|
|18    |          \ramloop[14].ram.r                 |blk_mem_gen_prim_width__parameterized13        |     1|
|19    |            \prim_init.ram                   |blk_mem_gen_prim_wrapper_init__parameterized13 |     1|
|20    |          \ramloop[1].ram.r                  |blk_mem_gen_prim_width__parameterized0         |     1|
|21    |            \prim_init.ram                   |blk_mem_gen_prim_wrapper_init__parameterized0  |     1|
|22    |          \ramloop[2].ram.r                  |blk_mem_gen_prim_width__parameterized1         |     1|
|23    |            \prim_init.ram                   |blk_mem_gen_prim_wrapper_init__parameterized1  |     1|
|24    |          \ramloop[3].ram.r                  |blk_mem_gen_prim_width__parameterized2         |     2|
|25    |            \prim_init.ram                   |blk_mem_gen_prim_wrapper_init__parameterized2  |     2|
|26    |          \ramloop[4].ram.r                  |blk_mem_gen_prim_width__parameterized3         |     1|
|27    |            \prim_init.ram                   |blk_mem_gen_prim_wrapper_init__parameterized3  |     1|
|28    |          \ramloop[5].ram.r                  |blk_mem_gen_prim_width__parameterized4         |     1|
|29    |            \prim_init.ram                   |blk_mem_gen_prim_wrapper_init__parameterized4  |     1|
|30    |          \ramloop[6].ram.r                  |blk_mem_gen_prim_width__parameterized5         |     1|
|31    |            \prim_init.ram                   |blk_mem_gen_prim_wrapper_init__parameterized5  |     1|
|32    |          \ramloop[7].ram.r                  |blk_mem_gen_prim_width__parameterized6         |     1|
|33    |            \prim_init.ram                   |blk_mem_gen_prim_wrapper_init__parameterized6  |     1|
|34    |          \ramloop[8].ram.r                  |blk_mem_gen_prim_width__parameterized7         |     2|
|35    |            \prim_init.ram                   |blk_mem_gen_prim_wrapper_init__parameterized7  |     2|
|36    |          \ramloop[9].ram.r                  |blk_mem_gen_prim_width__parameterized8         |     1|
|37    |            \prim_init.ram                   |blk_mem_gen_prim_wrapper_init__parameterized8  |     1|
+------+---------------------------------------------+-----------------------------------------------+------+
---------------------------------------------------------------------------------
Finished Writing Synthesis Report : Time (s): cpu = 00:02:39 ; elapsed = 00:03:15 . Memory (MB): peak = 1351.914 ; gain = 585.926
---------------------------------------------------------------------------------
Synthesis finished with 0 errors, 0 critical warnings and 174 warnings.
Synthesis Optimization Runtime : Time (s): cpu = 00:00:55 ; elapsed = 00:03:08 . Memory (MB): peak = 1351.914 ; gain = 585.926
Synthesis Optimization Complete : Time (s): cpu = 00:02:39 ; elapsed = 00:03:16 . Memory (MB): peak = 1351.914 ; gain = 585.926
INFO: [Project 1-571] Translating synthesized netlist
Netlist sorting complete. Time (s): cpu = 00:00:00 ; elapsed = 00:00:00.017 . Memory (MB): peak = 1351.914 ; gain = 0.000
INFO: [Netlist 29-17] Analyzing 15 Unisim elements for replacement
INFO: [Netlist 29-28] Unisim Transformation completed in 0 CPU seconds
INFO: [Project 1-570] Preparing netlist for logic optimization
INFO: [Opt 31-138] Pushed 0 inverter(s) to 0 load pin(s).
Netlist sorting complete. Time (s): cpu = 00:00:00 ; elapsed = 00:00:00.001 . Memory (MB): peak = 1351.914 ; gain = 0.000
INFO: [Project 1-111] Unisim Transformation Summary:
No Unisim elements were transformed.

INFO: [Common 17-83] Releasing license: Synthesis
17 Infos, 100 Warnings, 0 Critical Warnings and 0 Errors encountered.
synth_design completed successfully
synth_design: Time (s): cpu = 00:02:52 ; elapsed = 00:03:38 . Memory (MB): peak = 1351.914 ; gain = 869.773
Netlist sorting complete. Time (s): cpu = 00:00:00 ; elapsed = 00:00:00.001 . Memory (MB): peak = 1351.914 ; gain = 0.000
WARNING: [Constraints 18-5210] No constraints selected for write.
Resolution: This message can indicate that there are no constraints for the design, or it can indicate that the used_in flags are set such that the constraints are ignored. This later case is used when running synth_design to not write synthesis constraints to the resulting checkpoint. Instead, project constraints are read when the synthesized design is opened.
INFO: [Common 17-1381] The checkpoint 'D:/VivadoProject/FLXG/FLXG.runs/img_success_synth_1/img_success.dcp' has been generated.
WARNING: [Common 17-576] 'use_project_ipc' is deprecated. This option is deprecated and no longer used.
INFO: [Coretcl 2-1648] Added synthesis output to IP cache for IP img_success, cache-ID = 260f021063fe492c
INFO: [Coretcl 2-1174] Renamed 36 cell refs.
Netlist sorting complete. Time (s): cpu = 00:00:00 ; elapsed = 00:00:00.004 . Memory (MB): peak = 1351.914 ; gain = 0.000
WARNING: [Constraints 18-5210] No constraints selected for write.
Resolution: This message can indicate that there are no constraints for the design, or it can indicate that the used_in flags are set such that the constraints are ignored. This later case is used when running synth_design to not write synthesis constraints to the resulting checkpoint. Instead, project constraints are read when the synthesized design is opened.
INFO: [Common 17-1381] The checkpoint 'D:/VivadoProject/FLXG/FLXG.runs/img_success_synth_1/img_success.dcp' has been generated.
INFO: [runtcl-4] Executing : report_utilization -file img_success_utilization_synth.rpt -pb img_success_utilization_synth.pb
INFO: [Common 17-206] Exiting Vivado at Wed Feb  5 13:04:56 2020...
